{
  "id": "unrealscript",
  "name": "UnrealScript",
  "aliases": [],
  "category": "language",
  "subcategory": null,
  "developer": "Epic Games",
  "website": null,
  "license": "proprietary",
  "description": {
    "source": null,
    "custom": null
  },
  "externalIds": {
    "wikidata": "Q1191442"
  },
  "games": [],
  "statistics": {
    "gameCount": 0,
    "companyCount": 0,
    "totalSteamReviews": 0,
    "mostReviewedGames": [],
    "mostPlayedGames": [],
    "gamesByReleaseYear": {}
  },
  "sources": [
    {
      "type": "manual"
    }
  ],
  "lastUpdated": "2026-09-30T09:34:48.857Z"
}
