{
  "id": "heaps",
  "name": "Heaps",
  "aliases": [
    "Heaps.io"
  ],
  "category": "framework",
  "subcategory": null,
  "developer": null,
  "website": "https://heaps.io",
  "license": "open-source",
  "description": {
    "source": null,
    "custom": null
  },
  "externalIds": {
    "wikidata": "Q110373086"
  },
  "games": [
    "dead-cells"
  ],
  "statistics": {
    "gameCount": 1,
    "companyCount": 1,
    "totalSteamReviews": 184294,
    "mostReviewedGames": [
      {
        "id": "dead-cells",
        "title": "Dead Cells",
        "value": 184294
      }
    ],
    "mostPlayedGames": [
      {
        "id": "dead-cells",
        "title": "Dead Cells",
        "value": 2562
      }
    ],
    "gamesByReleaseYear": {
      "2018": 1
    }
  },
  "sources": [
    {
      "type": "manual"
    }
  ],
  "lastUpdated": "2026-09-30T09:34:48.857Z"
}
