{
  "id": "bevy",
  "name": "Bevy",
  "aliases": [
    "Bevy Engine"
  ],
  "category": "engine",
  "subcategory": null,
  "developer": null,
  "website": "https://bevyengine.org",
  "license": "open-source",
  "description": {
    "source": null,
    "custom": null
  },
  "externalIds": {
    "wikidata": "Q103819131"
  },
  "games": [],
  "statistics": {
    "gameCount": 0,
    "companyCount": 0,
    "totalSteamReviews": 0,
    "mostReviewedGames": [],
    "mostPlayedGames": [],
    "gamesByReleaseYear": {}
  },
  "sources": [
    {
      "type": "manual"
    }
  ],
  "lastUpdated": "2026-09-30T09:34:48.857Z"
}
