{
  "id": "amazon-lumberyard",
  "name": "Amazon Lumberyard",
  "aliases": [
    "Lumberyard"
  ],
  "category": "engine",
  "subcategory": null,
  "developer": "Amazon",
  "website": null,
  "license": "source-available",
  "description": {
    "source": null,
    "custom": null
  },
  "externalIds": {
    "wikidata": "Q22949502"
  },
  "games": [],
  "statistics": {
    "gameCount": 0,
    "companyCount": 0,
    "totalSteamReviews": 0,
    "mostReviewedGames": [],
    "mostPlayedGames": [],
    "gamesByReleaseYear": {}
  },
  "sources": [
    {
      "type": "manual"
    }
  ],
  "lastUpdated": "2026-09-30T09:34:48.857Z"
}
