{
  "id": "renpy",
  "name": "Ren'Py",
  "aliases": [
    "Ren Py",
    "RenPy"
  ],
  "category": "engine",
  "subcategory": "visual-novel",
  "developer": null,
  "website": "https://www.renpy.org",
  "license": "open-source",
  "description": {
    "source": null,
    "custom": null
  },
  "externalIds": {
    "wikidata": "Q1196014"
  },
  "games": [],
  "statistics": {
    "gameCount": 0,
    "companyCount": 0,
    "totalSteamReviews": 0,
    "mostReviewedGames": [],
    "mostPlayedGames": [],
    "gamesByReleaseYear": {}
  },
  "sources": [
    {
      "type": "manual"
    }
  ],
  "lastUpdated": "2026-09-30T09:34:48.857Z"
}
