{
  "id": "zbrush",
  "name": "ZBrush",
  "aliases": [],
  "category": "tool",
  "subcategory": "sculpting",
  "developer": "Maxon",
  "website": null,
  "license": "proprietary",
  "description": {
    "source": null,
    "custom": null
  },
  "externalIds": {
    "wikidata": "Q135964"
  },
  "games": [],
  "statistics": {
    "gameCount": 0,
    "companyCount": 0,
    "totalSteamReviews": 0,
    "mostReviewedGames": [],
    "mostPlayedGames": [],
    "gamesByReleaseYear": {}
  },
  "sources": [
    {
      "type": "manual"
    }
  ],
  "lastUpdated": "2026-09-30T09:34:48.857Z"
}
